{
  "schema_version": "1.0.0",
  "dataset_version": "0.1.0",
  "language": "en",
  "updated_at": "2026-10-18",
  "description": "Provisional research matrix for the Association Constitution Drafting Tool. All initial records await legal verification.",
  "records": [
    {
      "id": "common-law-personality",
      "topic": "Common-law voluntary associations",
      "dimension": "Legal form",
      "title": "Constitutional personality choices",
      "summary": "How should members constitute the association, define continuity, and allocate authority over assets and contracts?",
      "provision_type": "institutional_pattern",
      "legal_status": "common_law",
      "applicability": {
        "forms": [
          "voluntary-association"
        ],
        "activities": [
          "holding-property",
          "contracting"
        ],
        "conditions": "Research scope only; applicability has not been verified."
      },
      "legal_basis": null,
      "effective_from": null,
      "effective_to": null,
      "review_status": "awaiting_verification",
      "last_verified": null,
      "review_due": null,
      "reviewer": null,
      "updated_at": "2026-10-18",
      "generator_ready": false,
      "research_needed": "Identify the common-law and case-law tests for separate legal personality and the effect of the proposed constitution.",
      "sources": [
        {
          "title": "White paper §3.2",
          "url": "/en/white-paper#part-i-3",
          "locator": null,
          "source_checked_on": null
        }
      ],
      "change_history": [
        {
          "date": "2026-10-18",
          "note": "Initial research record derived from the white paper; not a verified legal rule."
        }
      ]
    },
    {
      "id": "npo-founding-document",
      "topic": "Registered NPOs",
      "dimension": "Registration status",
      "title": "Founding-document requirements",
      "summary": "Which founding-document provisions apply when applying for NPO registration?",
      "provision_type": "legal_requirement",
      "legal_status": "enacted",
      "applicability": {
        "forms": [
          "voluntary-association",
          "trust",
          "non-profit-company"
        ],
        "activities": [
          "npo-registration"
        ],
        "conditions": "Research scope only; applicability has not been verified."
      },
      "legal_basis": null,
      "effective_from": null,
      "effective_to": null,
      "review_status": "awaiting_verification",
      "last_verified": null,
      "review_due": null,
      "reviewer": null,
      "updated_at": "2026-10-18",
      "generator_ready": false,
      "research_needed": "Verify the current amended section 12 requirements, scope, and registration triggers; do not treat registration as a legal form.",
      "sources": [
        {
          "title": "Nonprofit Organisations Act 71 of 1997",
          "url": "https://www.gov.za/documents/nonprofit-organisations-act",
          "locator": null,
          "source_checked_on": null
        }
      ],
      "change_history": [
        {
          "date": "2026-10-18",
          "note": "Initial research record derived from the white paper; not a verified legal rule."
        }
      ]
    },
    {
      "id": "npc-membership",
      "topic": "Non-profit companies",
      "dimension": "Legal form",
      "title": "Membership and governance options",
      "summary": "Which membership and governance structure would support member control?",
      "provision_type": "institutional_pattern",
      "legal_status": "enacted",
      "applicability": {
        "forms": [
          "non-profit-company"
        ],
        "activities": [
          "incorporation"
        ],
        "conditions": "Research scope only; applicability has not been verified."
      },
      "legal_basis": null,
      "effective_from": null,
      "effective_to": null,
      "review_status": "awaiting_verification",
      "last_verified": null,
      "review_due": null,
      "reviewer": null,
      "updated_at": "2026-10-18",
      "generator_ready": false,
      "research_needed": "Map the Companies Act and memorandum of incorporation requirements separately from democratic recommendations.",
      "sources": [
        {
          "title": "Companies Act 71 of 2008",
          "url": "https://www.npa.gov.za/media/companies-act-2008-act-71-2008",
          "locator": null,
          "source_checked_on": null
        }
      ],
      "change_history": [
        {
          "date": "2026-10-18",
          "note": "Initial research record derived from the white paper; not a verified legal rule."
        }
      ]
    },
    {
      "id": "cooperative-governance",
      "topic": "Co-operatives",
      "dimension": "Legal form",
      "title": "Member control and founding rules",
      "summary": "Which founding rules and member-governance obligations apply to the chosen cooperative type?",
      "provision_type": "legal_requirement",
      "legal_status": "enacted",
      "applicability": {
        "forms": [
          "cooperative"
        ],
        "activities": [
          "cooperative-registration"
        ],
        "conditions": "Research scope only; applicability has not been verified."
      },
      "legal_basis": null,
      "effective_from": null,
      "effective_to": null,
      "review_status": "awaiting_verification",
      "last_verified": null,
      "review_due": null,
      "reviewer": null,
      "updated_at": "2026-10-18",
      "generator_ready": false,
      "research_needed": "Verify the current Act, amendments, regulations, and category-specific requirements.",
      "sources": [
        {
          "title": "White paper §3.5",
          "url": "/en/white-paper#part-i-3",
          "locator": null,
          "source_checked_on": null
        }
      ],
      "change_history": [
        {
          "date": "2026-10-18",
          "note": "Initial research record derived from the white paper; not a verified legal rule."
        }
      ]
    },
    {
      "id": "trust-authority",
      "topic": "Trusts",
      "dimension": "Legal form",
      "title": "Trustee authority and member participation",
      "summary": "How can trustee authority and participatory arrangements be made understandable and accountable?",
      "provision_type": "prudent_safeguard",
      "legal_status": "enacted",
      "applicability": {
        "forms": [
          "trust"
        ],
        "activities": [
          "holding-property"
        ],
        "conditions": "Research scope only; applicability has not been verified."
      },
      "legal_basis": null,
      "effective_from": null,
      "effective_to": null,
      "review_status": "awaiting_verification",
      "last_verified": null,
      "review_due": null,
      "reviewer": null,
      "updated_at": "2026-10-18",
      "generator_ready": false,
      "research_needed": "Verify the trust instrument, applicable statutory duties, and limits of member decision-making.",
      "sources": [
        {
          "title": "White paper §3.5",
          "url": "/en/white-paper#part-i-3",
          "locator": null,
          "source_checked_on": null
        }
      ],
      "change_history": [
        {
          "date": "2026-10-18",
          "note": "Initial research record derived from the white paper; not a verified legal rule."
        }
      ]
    },
    {
      "id": "cpa-governance",
      "topic": "Communal-property associations",
      "dimension": "Legal form",
      "title": "Collective land governance",
      "summary": "Which membership, land-governance, and reporting provisions apply?",
      "provision_type": "legal_requirement",
      "legal_status": "enacted",
      "applicability": {
        "forms": [
          "communal-property-association"
        ],
        "activities": [
          "collective-landholding"
        ],
        "conditions": "Research scope only; applicability has not been verified."
      },
      "legal_basis": null,
      "effective_from": null,
      "effective_to": null,
      "review_status": "awaiting_verification",
      "last_verified": null,
      "review_due": null,
      "reviewer": null,
      "updated_at": "2026-10-18",
      "generator_ready": false,
      "research_needed": "Verify the current communal-property association regime and land-specific circumstances before drafting.",
      "sources": [
        {
          "title": "White paper §3.5",
          "url": "/en/white-paper#part-i-3",
          "locator": null,
          "source_checked_on": null
        }
      ],
      "change_history": [
        {
          "date": "2026-10-18",
          "note": "Initial research record derived from the white paper; not a verified legal rule."
        }
      ]
    },
    {
      "id": "stokvel-exemption",
      "topic": "Stokvels and common-bond exemptions",
      "dimension": "Activity-specific regime",
      "title": "Financial activity and exemption conditions",
      "summary": "Does the proposed saving or lending activity fall within an applicable exemption, and on what conditions?",
      "provision_type": "legal_requirement",
      "legal_status": "uncertain",
      "applicability": {
        "forms": [
          "any"
        ],
        "activities": [
          "pooling-savings",
          "lending"
        ],
        "conditions": "Research scope only; applicability has not been verified."
      },
      "legal_basis": null,
      "effective_from": null,
      "effective_to": null,
      "review_status": "awaiting_verification",
      "last_verified": null,
      "review_due": null,
      "reviewer": null,
      "updated_at": "2026-10-18",
      "generator_ready": false,
      "research_needed": "Identify the current designation or exemption, thresholds, scope, and duties; a social label alone must not activate an exemption.",
      "sources": [
        {
          "title": "White paper §3.6",